<?xml version="1.0" encoding="utf-8" ?>
<!DOCTYPE Lieferschein SYSTEM "Lieferschein.dtd">
<Lieferschein xmlns="https://www.w3schools.com/lieferschein"
              xmlns:xsi="http://www.w3.org/2001/XMLSchema-instance"
              xsi:schemaLocation="https://www.w3schools.com/lieferschein Lieferschein.xsd">
    <AuftragsNr>123456</AuftragsNr>
    <AufragsDatum>2023-01-01</AufragsDatum>
    <KundenNr>123456</KundenNr>
    <KundenName>Muster AG</KundenName>
    <Adressen>
        <Absender>
            <Firma>Reitartikelversand Express AG</Firma>
            <Anrede>Herr</Anrede>
            <Vorname>Philipp</Vorname>
            <Name>Martin</Name>
            <Strasse>Rauracherweg</Strasse>
            <StrasseNr>10</StrasseNr>
            <PLZ>4132</PLZ>
            <Ort>Muttenz</Ort>
            <Land>Schweiz</Land>
        </Absender>
        <Empfaenger>
            <Firma>Muster AG</Firma>
            <Anrede>Herr</Anrede>
            <Vorname>Hans</Vorname>
            <Name>Muster</Name>
            <Strasse>Musterstrasse</Strasse>
            <StrasseNr>1</StrasseNr>
            <PLZ>4132</PLZ>
            <Ort>Muttenz</Ort>
            <Land>Schweiz</Land>
        </Empfaenger>
    </Adressen>
    <Lieferung>
        <Artikel>
            <ArtikelNummer>10000001</ArtikelNummer>
            <Bezeichnung>Sattel</Bezeichnung>
            <Menge>1</Menge>
            <VersandDatum>2023-01-08</VersandDatum>
            <GeplantesLieferDatum>2023-01-10</GeplantesLieferDatum>
        </Artikel>
        <Artikel>
            <ArtikelNummer>20000001</ArtikelNummer>
            <Bezeichnung>Stiefel</Bezeichnung>
            <Menge>2</Menge>
            <VersandDatum>2023-01-08</VersandDatum>
            <GeplantesLieferDatum>2023-01-10</GeplantesLieferDatum>
        </Artikel>
    </Lieferung>
</Lieferschein>